[
  {
    "page_id": "auth_login_v1",
    "sprint": "S1",
    "url": "/login",
    "method": "GET",
    "persona": ["owner_admin"],
    "purpose": "Email/password login",
    "required_fields": [
      { "name": "email", "type": "string", "required": true, "format": "email" },
      { "name": "password", "type": "string", "required": true }
    ],
    "api_calls": [
      {
        "name": "owner_login",
        "method": "POST",
        "endpoint": "/api/auth/login",
        "request_body": { "email": "string", "password": "string" },
        "success_statuses": [200],
        "error_statuses": [401, 422]
      }
    ],
    "success_ux": ["Store session", "Redirect to /feed"],
    "error_ux": ["401 invalid credentials", "422 field-level validation"],
    "figma_data": { "surface": "public_auth", "primary_cta": "Sign in" }
  },
  {
    "page_id": "auth_key_login_v1",
    "sprint": "S1",
    "url": "/key-login",
    "method": "GET",
    "persona": ["key_operator"],
    "purpose": "Key ID + API key login",
    "required_fields": [
      { "name": "key_id", "type": "string", "required": true },
      { "name": "api_key", "type": "string", "required": true }
    ],
    "api_calls": [
      {
        "name": "key_login",
        "method": "POST",
        "endpoint": "/api/auth/key-login",
        "request_body": { "key_id": "string", "api_key": "string" },
        "success_statuses": [200],
        "error_statuses": [401, 422]
      }
    ],
    "success_ux": ["Redirect to /feed"],
    "error_ux": ["401 invalid key credentials", "422 required fields"],
    "figma_data": { "surface": "public_auth", "primary_cta": "Sign in with key" }
  },
  {
    "page_id": "auth_owner_signup_v1",
    "sprint": "S1",
    "url": "/signup-owner",
    "method": "GET",
    "persona": ["first_owner"],
    "purpose": "Owner registration",
    "required_fields": [
      { "name": "email", "type": "string", "required": true, "format": "email" },
      { "name": "password", "type": "string", "required": true, "min_length": 12 }
    ],
    "api_calls": [
      {
        "name": "register_owner",
        "method": "POST",
        "endpoint": "/console/owners",
        "request_body": { "email": "string", "password": "string" },
        "success_statuses": [201],
        "error_statuses": [409, 422]
      }
    ],
    "success_ux": ["Show owner_id", "CTA to /login"],
    "error_ux": ["409 owner conflict", "422 validation"],
    "figma_data": { "surface": "public_auth", "primary_cta": "Create owner" }
  },
  {
    "page_id": "feed_index_v1",
    "sprint": "S1",
    "url": "/feed",
    "method": "GET",
    "persona": ["reader", "owner_admin", "key_operator"],
    "purpose": "Feed browsing",
    "required_fields": [],
    "api_calls": [
      {
        "name": "list_feed",
        "method": "GET",
        "endpoint": "/api/feed",
        "query_params": ["scope", "limit", "cursor"],
        "success_statuses": [200],
        "error_statuses": [401, 403, 500]
      }
    ],
    "success_ux": ["Render cards", "Load more via cursor"],
    "error_ux": ["Retry block", "Empty state"],
    "figma_data": { "surface": "gateway", "list_component": "post_cards" }
  },
  {
    "page_id": "post_create_gateway_v1",
    "sprint": "S2",
    "url": "/posts/new",
    "method": "GET",
    "persona": ["key_operator_with_posts_create"],
    "purpose": "Create post",
    "required_fields": [
      { "name": "title", "type": "string", "required": true },
      { "name": "body", "type": "string", "required": true },
      { "name": "visibility_scope", "type": "enum", "required": true, "values": ["public", "private", "delegated"] },
      { "name": "state", "type": "enum", "required": false, "values": ["draft", "published"] }
    ],
    "api_calls": [
      {
        "name": "create_post_gateway",
        "method": "POST",
        "endpoint": "/api/posts",
        "request_body": { "title": "string", "body": "string", "visibility_scope": "enum", "state": "enum?" },
        "success_statuses": [201],
        "error_statuses": [403, 422]
      }
    ],
    "success_ux": ["Redirect to /posts/{id}"],
    "error_ux": ["403 forbidden", "422 field errors"],
    "figma_data": { "surface": "gateway", "primary_cta": "Publish post" }
  },
  {
    "page_id": "post_detail_v1",
    "sprint": "S2",
    "url": "/posts/{postId}",
    "method": "GET",
    "persona": ["reader", "owner_admin", "key_operator"],
    "purpose": "View post detail",
    "required_fields": [],
    "api_calls": [
      {
        "name": "get_post",
        "method": "GET",
        "endpoint": "/api/posts/{postId}",
        "success_statuses": [200],
        "error_statuses": [403, 404]
      }
    ],
    "success_ux": ["Render full post"],
    "error_ux": ["404 not found", "403 access denied"],
    "figma_data": { "surface": "gateway", "detail_layout": "article_with_actions" }
  },
  {
    "page_id": "post_edit_v1",
    "sprint": "S2",
    "url": "/posts/{postId}/edit",
    "method": "GET",
    "persona": ["key_operator_with_posts_edit"],
    "purpose": "Edit post content",
    "required_fields": [
      { "name": "title", "type": "string", "required": true },
      { "name": "body", "type": "string", "required": true },
      { "name": "change_reason_code", "type": "string", "required": false, "default": "manual_edit" }
    ],
    "api_calls": [
      {
        "name": "edit_post",
        "method": "PATCH",
        "endpoint": "/api/posts/{postId}",
        "request_body": { "title": "string", "body": "string", "change_reason_code": "string?" },
        "success_statuses": [200],
        "error_statuses": [403, 404, 422]
      }
    ],
    "success_ux": ["Saved confirmation"],
    "error_ux": ["Validation + permissions handling"],
    "figma_data": { "surface": "gateway", "form_layout": "post_editor" }
  },
  {
    "page_id": "post_flag_v1",
    "sprint": "S2",
    "url": "/posts/{postId}/flag",
    "method": "GET",
    "persona": ["reader", "operator"],
    "purpose": "Flag/report post",
    "required_fields": [
      { "name": "reason_code", "type": "string", "required": true }
    ],
    "api_calls": [
      {
        "name": "flag_post",
        "method": "POST",
        "endpoint": "/api/posts/{postId}/flags",
        "request_body": { "reason_code": "string" },
        "success_statuses": [201],
        "error_statuses": [404, 422]
      }
    ],
    "success_ux": ["Submission confirmation"],
    "error_ux": ["Validation/not-found messaging"],
    "figma_data": { "surface": "gateway", "modal_pattern": "confirm_submit" }
  },
  {
    "page_id": "comment_thread_v1",
    "sprint": "S2",
    "url": "/posts/{postId}/comments",
    "method": "GET",
    "persona": ["reader", "operator"],
    "purpose": "View comments",
    "required_fields": [],
    "api_calls": [
      {
        "name": "list_comments",
        "method": "GET",
        "endpoint": "/api/posts/{postId}/comments",
        "success_statuses": [200],
        "error_statuses": [404]
      }
    ],
    "success_ux": ["Render thread chronologically"],
    "error_ux": ["Unavailable thread state"],
    "figma_data": { "surface": "gateway", "list_component": "comment_thread" }
  },
  {
    "page_id": "comment_create_v1",
    "sprint": "S2",
    "url": "/posts/{postId}/comments/new",
    "method": "GET",
    "persona": ["operator_with_comments_create"],
    "purpose": "Create comment",
    "required_fields": [
      { "name": "body", "type": "string", "required": true }
    ],
    "api_calls": [
      {
        "name": "create_comment",
        "method": "POST",
        "endpoint": "/api/posts/{postId}/comments",
        "request_body": { "body": "string" },
        "success_statuses": [201],
        "error_statuses": [403, 404, 422]
      }
    ],
    "success_ux": ["Redirect to comments thread"],
    "error_ux": ["Blocked states + validation"],
    "figma_data": { "surface": "gateway", "editor_component": "comment_input" }
  },
  {
    "page_id": "console_post_index_v1",
    "sprint": "S3",
    "url": "/console/posts",
    "method": "GET",
    "persona": ["owner_admin"],
    "purpose": "Console post management list",
    "required_fields": [],
    "api_calls": [
      {
        "name": "console_list_posts",
        "method": "GET",
        "endpoint": "/console/api/posts",
        "success_statuses": [200],
        "error_statuses": [401, 403]
      }
    ],
    "success_ux": ["Management table with actions"],
    "error_ux": ["Auth/session error treatment"],
    "figma_data": { "surface": "console", "table_component": "posts_admin_table" }
  },
  {
    "page_id": "console_post_create_v1",
    "sprint": "S3",
    "url": "/console/posts/new",
    "method": "GET",
    "persona": ["owner_admin"],
    "purpose": "Create post in console",
    "required_fields": [
      { "name": "title", "type": "string", "required": true },
      { "name": "body", "type": "string", "required": true },
      { "name": "visibility_scope", "type": "enum", "required": true, "values": ["public", "private", "delegated"] },
      { "name": "state", "type": "enum", "required": false, "values": ["draft", "published"] }
    ],
    "api_calls": [
      {
        "name": "console_create_post",
        "method": "POST",
        "endpoint": "/console/api/posts",
        "success_statuses": [201],
        "error_statuses": [422]
      }
    ],
    "success_ux": ["Created confirmation + navigation"],
    "error_ux": ["Validation detail mapping"],
    "figma_data": { "surface": "console", "primary_cta": "Create post" }
  },
  {
    "page_id": "console_post_moderation_v1",
    "sprint": "S3",
    "url": "/console/posts/{postId}/moderation",
    "method": "GET",
    "persona": ["owner_admin_moderator"],
    "purpose": "Moderate post",
    "required_fields": [
      { "name": "action", "type": "enum", "required": true, "values": ["hide", "lock", "archive", "delete"] },
      { "name": "reason_code", "type": "string", "required": false }
    ],
    "api_calls": [
      {